main-news,MSRpar,2012train,212,2.75,"एफबीआय, सीआयए, कॅनेडियन सिक्युरिटी इंटेलिजेंस सर्व्हिस आणि रॉयल कॅनेडियन माउंट पोलिसांच्या प्रवक्त्यांनी कॅनडामध्ये एल शुक्रिजुमाहच्या मुक्कामावर भाष्य करण्यास नकार दिला.","एफबीआय, सीआयए, कॅनेडियन सुरक्षा बुद्धिमत्ता सेवा आणि रॉयल कॅनेडियन माउंट पोलिसांनी वॉशिंग्टन टाईम्सच्या अहवालावर भाष्य करण्यास नकार दिला."
main-news,MSRpar,2012train,213,4,"ही एक सतत समस्या आहे जी सोडविली गेली नाही, असे तपास मंडळाचे सदस्य स्टीव्हन वॉलेस यांनी सांगितले.","ही एक सतत समस्या होती जी यांत्रिक आणि शारीरिकदृष्ट्या सोडविली गेली नाही, असे बोर्डाचे सदस्य स्टीव्हन वॉलेस म्हणाले."
main-news,MSRpar,2012train,215,3.6,"अमेरिकन लोक कापत नाहीत आणि धावत नाहीत, आम्हाला ही चुकीची माहिती पहावी लागेल, असे ती म्हणाली.","तिने इराकला शांतता आणण्याचेही वचन दिले: ""अमेरिकन लोक कापत नाहीत आणि धावत नाहीत, आम्हाला ही चुकीची माहिती पहावी लागेल."""
main-news,MSRpar,2012train,217,3.8,"रासायनिक कार्यक्रम, जैविक कार्यक्रम, खरंच अणु कार्यक्रम, यूएनने दस्तऐवजीकरण केलेल्या सर्व गोष्टींबद्दल शंका नाही, असे ते म्हणाले.","ते पुढे म्हणाले: ""रासायनिक कार्यक्रम, जैविक कार्यक्रम आणि खरंच अण्वस्त्र कार्यक्रमाबद्दल यात काही शंका नाही."
main-news,MSRpar,2012train,220,4.6,रिज म्हणाले की व्यायामामध्ये कोणतेही वास्तविक स्फोटके किंवा हानिकारक उपकरणे वापरली जाणार नाहीत.,रिज म्हणाले की कोणतेही वास्तविक स्फोटके किंवा इतर हानिकारक पदार्थ वापरले जाणार नाहीत.
main-news,MSRpar,2012train,222,3.25,"हे अमेरिका आहे, माझे मित्र आहेत आणि ते येथे घडू नये, ""तो मोठ्याने टाळ्याला म्हणाला.","हे अमेरिका आहे, माझे मित्र आहेत आणि ते येथे होऊ नये."
main-news,MSRpar,2012train,226,3.75,"1 मे रोजी, तो अरुंद, वळण घेणार्‍या कॅनियनमधून रेंगाळला, 60 फूट उंच कडा खाली उतरला आणि कॅनियनच्या काही मैलांच्या अंतरावर चालला.","तो अरुंद, वळण घेणार्‍या कॅनियनमधून रेंगाळला, 60 फूट उंच कडा खाली उतरला आणि दक्षिण-पूर्व युटामधील कॅनियनलँड्स नॅशनल पार्कजवळील कॅनियनच्या खाली काही मैलांवर चालला."
main-news,MSRpar,2012train,227,4,"अ‍ॅम्नेस्टी इंटरनॅशनलने म्हटले आहे की गेल्या २० वर्षांत त्याने इराकमध्ये १,000,००० गायब झाल्याची माहिती गोळा केली आहे परंतु वास्तविक आकृती जास्त असू शकते.","अ‍ॅम्नेस्टी इंटरनॅशनलने म्हटले आहे की गेल्या २० वर्षांत त्याने इराकमध्ये १,000,००० गायब झाल्याची माहिती गोळा केली होती."
main-news,MSRpar,2012train,229,3.75,टेक्सास इन्स्ट्रुमेंट्स काल $ 1.37 ते 19.25 डॉलर आणि नोव्हलस सिस्टम्स इंक. प्रगत 76 1.76 ते .3 36.31.,"टेक्सास इन्स्ट्रुमेंट्स $ यूएस 1.37 वरून $ यूएस 19.25 वर चढली आणि नोव्हेलस सिस्टम्सने US 1.76 ते $ यूएस 36.31 पर्यंत वाढविले, प्रत्येक लेहमनने ""जास्त वजन"" वर वाढविले."
main-news,MSRpar,2012train,230,3.455,रवांडा आणि युगांडाच्या अध्यक्षांसमवेत बैठकीची तयारी करण्यासाठी तिने गेल्या आठवड्याच्या मंत्रिमंडळाच्या सत्रापासून माफ करण्यास सांगितले.,रवांडा आणि युगांडाच्या अध्यक्षांसमवेत झालेल्या बैठकीस उपस्थित राहण्यासाठी तिने कॅबिनेट वगळण्याचे अत्यंत विलक्षण पाऊल उचलले.
main-news,MSRpar,2012train,233,4,"प्राचीन मूर्तिपूजक आणि आधुनिक ख्रिश्चन संस्कारांच्या मिश्रणात, ग्रामस्थांनी त्यांना गरीब राहिले आहे असा विश्वास असलेल्या दुर्दैवाने पुसून टाकण्याच्या आशेने अनेक समारंभांची मालिका तयार केली आहे.",प्राचीन मेलेनेशियन मूर्तिपूजक आणि आधुनिक ख्रिश्चन समारंभांच्या मिश्रणात लोकांनी पुन्हा एकदा त्यांना विश्वास ठेवला की दुर्दैवाने पुसून टाकण्याचा प्रयत्न केला.
main-news,MSRpar,2012train,234,2.5,"डो जोन्स इंडस्ट्रियल एव्हरेज .डीजीने 13.33 गुण किंवा 0.15 टक्क्यांनी वाढून 9,196.55 पर्यंत वाढ केली.","डो जोन्स औद्योगिक सरासरी <.dji> 75.7575 गुण किंवा ०.०8 टक्के, ,, १757575.47 वर होते."
main-news,MSRpar,2012train,235,0.25,माँकीपॉक्स सहसा फक्त मध्य आणि पश्चिम आफ्रिकेत आढळतो.,सामान्यत: नै w त्य आणि पश्चिम राज्यांमध्ये आढळणारे प्रेरी कुत्री विस्कॉन्सिनचे स्वदेशी आहेत.
main-news,MSRpar,2012train,238,3.833,"हा चित्रपट ट्रायलॉजीचा दुसरा आहे, जो नोव्हेंबरमध्ये मॅट्रिक्स रिव्होल्यूशन्ससह गुंडाळला जाईल.","रीलोड केलेला हा त्रिकूटचा दुसरा हप्ता आहे; ""द मॅट्रिक्स रिव्होल्यूशन्स"" नोव्हेंबरमध्ये पदार्पण होणार आहे."
main-news,MSRpar,2012train,239,3.75,"याव्यतिरिक्त, न्याय विभागाने म्हटले आहे की एफबीआयने मशिदींच्या भेटींसह '' 10 पेक्षा कमी '' 'तपास केला आहे.","याव्यतिरिक्त, ""10 पेक्षा कमी"" एफबीआय कार्यालयांनी इस्लामिक मशिदींच्या भेटींसह तपास केला आहे, असे न्याय विभागाने सांगितले."
main-news,MSRpar,2012train,240,3.25,या आठवड्यात सॅन फ्रान्सिस्कोमध्ये जावाओन विकसकांच्या परिषदेत लॉन्च होते.,सॅन फ्रान्सिस्कोमध्ये सन वार्षिक जावॉन डेव्हलपर्स परिषदेच्या संयोगानेही ही बातमी आहे.
main-news,MSRpar,2012train,241,2.75,"रॉयल ड्यूटी डायना, राजकुमारी ऑफ वेल्स आणि तिच्याकडून आणि तिच्याकडून कथित पत्रांच्या अनुभवांवर आधारित आहे.","राजकुमारी ऑफ वेल्सच्या डायना, पूर्वीच्या सेवकाच्या काळाच्या आधारे रॉयल घरातील रॉयल ड्युटीमध्ये आणखी खुलासे आणत होती."
main-news,MSRpar,2012train,242,3,इस्त्रायली सैन्याने शहरातील हमासचे नेते अब्दुल्ला कावास्मे यांना गोळ्या घालून ठार मारल्यानंतर काही दिवसानंतर येणा The ्या या हल्ल्यात हमासमधील अतिरेक्यांना लक्ष्य केले.,इस्त्रायली सैन्याने हेब्रोनमधील अतिरेकी गटाचे नेते अब्दुल्ला कावास्मे यांना गोळ्या घालून ठार मारल्यानंतर काही दिवसांनी अटक करण्यात आली.
main-news,MSRpar,2012train,244,3.2,"एसएआरएसने टोरोंटो परिसरातील 44 लोकांच्या जीवनाचा दावा केला, ज्यात दोन परिचारिका आणि डॉक्टर यांचा समावेश आहे.","टोरोंटो परिसरातील विषाणूने 44 लोकांना ठार मारले, ज्यात एक डॉक्टर आणि दोन परिचारिका आहेत."
main-news,MSRpar,2012train,245,4.6,"Apple पल कॉम्प्यूटरच्या नवीन ऑनलाइन संगीत सेवेने ऑपरेशनच्या पहिल्या आठवड्यात 1 दशलक्षाहून अधिक गाणी विकली, असे कंपनीने सोमवारी सांगितले.","Apple पल कॉम्प्यूटर इंक. सोमवारी म्हणाले की, एका आठवड्यापूर्वी ऑनलाइन संगीत स्टोअर सुरू झाल्यापासून ते 1 दशलक्षाहून अधिक गाणी विकून रेकॉर्ड उद्योगाच्या अपेक्षांपेक्षा जास्त आहे."
main-news,MSRpar,2012train,246,3.6,त्याला यापूर्वी दोनदा अटक करण्यात आली होती आणि त्याच्या आई आणि दोन मुलांच्या घरी - कॉम्प्लेक्स - या कॉम्प्लेक्सपासून बंदी घालण्यात आली होती.,अपहरण केल्याबद्दल त्याला यापूर्वी दोनदा अटक करण्यात आली होती आणि त्या कॉम्प्लेक्सपासून त्याला प्रतिबंधित केले गेले होते.
main-news,MSRpar,2012train,247,4.4,ओरॅकल कॉर्पचे अध्यक्ष आणि मुख्य कार्यकारी अधिकारी लॅरी एलिसन यांनी प्रतिस्पर्धी पीपलसॉफ्ट इंक मिळविण्याच्या कंपनीच्या अवांछित ऑफरला गोड करण्यास नकार दिला नाही.,ओरॅकलचे अध्यक्ष लॅरी एलिसन यांनी असा इशारा दिला आहे की कंपनीने पुन्हा प्रतिस्पर्धी पीपलसॉफ्टची ऑफर वाढविली आहे.
main-news,MSRpar,2012train,249,4.056,"पोर्तुगीज हवामान सेवेने म्हटले आहे की युरोपची हीटवेव्ह आग्नेय पूर्वेकडून गरम, कोरड्या हवेच्या वस्तुमानामुळे झाली.","पोर्तुगालच्या हवामान सेवेच्या मारिओ अल्मेडा यांनी सांगितले की, हीटवेव्ह दक्षिण -पूर्वेकडून गरम, कोरड्या हवेच्या वस्तुमानामुळे होते."
main-news,MSRpar,2012train,250,3.5,"दहशतवाद सट्टेबाजी करण्यासाठी करदात्या डॉलर खर्च करणे हे जितके विटंबना आहे तितकेच व्यर्थ आहे, त्यांनी काल पत्रकार परिषदेत जाहीर केले.","दहशतवाद सट्टेबाजी करण्यासाठी करदात्याचे डॉलर्स खर्च करणे हे विटंबनाइतकेच व्यर्थ आहे, असेन आणि डॉर्गन यांनी सोमवारी पेंटागॉनला लिहिलेल्या पत्रात सांगितले."
main-news,MSRpar,2012train,251,5,"तरीही, ""काहीसे अस्पष्ट निर्णय"" हे प्रतिस्पर्धी उत्पादन कसे विकसित केले यावर अवलंबून स्थिर नियंत्रणासाठी एक धक्का असू शकेल, असे मेरिल लिंच विश्लेषक स्टीव्हन मिलुनोविच यांनी सांगितले.","परंतु मेरिल लिंच विश्लेषक स्टीव्हन मिलुनोविच म्हणाले की, नियामकांनी ""काहीसे अस्पष्ट निर्णय"" हे त्याचे प्रतिस्पर्धी उत्पादन कसे विकसित केले यावर अवलंबून स्थिर नियंत्रणासाठी एक धक्का असू शकतो."
main-news,MSRpar,2012train,254,4,आर्मचे योजनाबद्ध प्रतिनिधित्व आणि व्हिडिओ स्क्रीनवर त्याच्या हालचाली पाहून माकड त्यांच्या प्रगतीचा मागोवा घेऊ शकतात.,"हात एका वेगळ्या खोलीत ठेवण्यात आला होता, परंतु माकडांनी आर्मचे प्रतिनिधित्व आणि व्हिडिओ स्क्रीनवर त्याच्या हालचाली पाहून त्यांच्या प्रगतीचा मागोवा घेतला."
main-news,MSRpar,2012train,255,4,डाउनटाउन वॉशिंग्टन आणि नॉर्दर्न व्हर्जिनियामध्ये वाहतुकीचा बॅक अप घेतल्यामुळे हजारो प्रवाशांना गैरसोयीचे 47 तासांच्या पोलिसांच्या अडचणीत चालना मिळाली.,त्याच्या निषेधामुळे पोलिसांसमवेत 47-तासांची स्थिती निर्माण झाली ज्यामुळे डाउनटाउन वॉशिंग्टन आणि नॉर्दर्न व्हर्जिनियामध्ये प्रचंड वाहतुकीची कोंडी झाली.
main-news,MSRpar,2012train,256,4.75,"मानक आणि गरीबांचे 500 निर्देशांक 6.48 किंवा 0.7 टक्के, 990.51 वर गेला.","व्यापक मानक आणि गरीबचे 500 निर्देशांक .4.48 गुण, किंवा 0.66 टक्क्यांनी वाढून 990.51 वर वाढले."
main-news,MSRpar,2012train,257,3.75,शंभराहून अधिक देशांतील कृषी मंत्र्यांनी अमेरिकेच्या कृषी विभागाने प्रायोजित केलेल्या कृषी विज्ञान आणि तंत्रज्ञानावरील तीन दिवसीय मंत्री परिषद आणि एक्सपोमध्ये भाग घेण्याची अपेक्षा आहे.,अमेरिकेचे कृषी सचिव अ‍ॅन व्हेनमन यांनी सोमवारी तीन दिवसीय मंत्री परिषद आणि कृषी विज्ञान आणि तंत्रज्ञानावरील एक्सपो सुरू केली.
main-news,MSRpar,2012train,259,4,परिस्थितीला गुंतागुंत करणे म्हणजे दोन्ही बाजूंनी लढा देणा light ्या लढाई-कठोर लाइबेरियन्सची उपस्थिती.,"पाश्चिमात्य देशात लढाईत तुरळक सुरूच राहिले आहे, जिथे दोन्ही बाजूंनी लढाई-कठोर लाइबेरियन्सच्या उपस्थितीमुळे हे गुंतागुंतीचे आहे."
main-news,MSRpar,2012train,260,3.5,यावर्षी ऑडबॉन सोसायटी पुन्हा एकदा त्याच्या वार्षिक ख्रिसमस बर्ड गणनाचे आयोजन करते.,हे आता 104 व्या हंगामात नॅशनल ऑडबॉन सोसायटीची वार्षिक ख्रिसमस बर्ड गणना आहे.
main-news,MSRpar,2012train,261,3,"ते काढण्यापूर्वी, तुटलेल्या इंग्रजीमध्ये सूचीबद्ध केलेली साइट हॅकर्ससाठी नियमांचे नियम आहेत.","आयोजकांनी एक वेबसाइट स्थापित केली, http://defacerschallenge.com, तुटलेल्या इंग्रजीमध्ये सूचीबद्ध असलेल्या हॅकर्सच्या नियमांचे नियम आहेत."
main-news,MSRpar,2012train,263,4.2,डॉक्टरांनी असा अंदाज लावला आहे की बॉडीचे स्वतःचे इस्ट्रोजेन पेशींच्या नुकसानीपासून संरक्षण करते आणि रक्त प्रवाह सुधारते.,त्यांचा विश्वास एस्ट्रोजेन सेलचे नुकसान प्रतिबंधित करतो आणि रक्त प्रवाह सुधारतो या अटकळावर आधारित होता.
main-news,MSRpar,2012train,264,3.4,त्यांना देखील आढळले की कमतरता सुनावणीच्या नुकसानीच्या कौटुंबिक इतिहासाशी संबंधित आहे.,श्रवणशक्ती कमी होणा in ्यांमध्ये दोनदा लहानपणा आढळला.
main-news,MSRpar,2012train,265,4.6,"सिस्कोच्या अधिका said ्यांनी सांगितले की त्यांना १.3 अब्ज डॉलर्स रोख प्रवाह आणि निव्वळ उत्पन्नात वाढ झाली आहे, परंतु त्यांना परत मिळण्याची आशा आहे.","सिस्कोच्या अधिका u ्यांना १.3 अब्ज डॉलर्स रोख प्रवाह आणि निव्वळ उत्पन्नात वाढ झाली, परंतु ते म्हणाले की ते `` सावधगिरीने आशावादी आहेत."
main-news,MSRpar,2012train,266,4,"नॉक्सविले न्यूज सेंटिनेलला ई-मेल निवेदनात शुमाकर म्हणाले, '' मी राजीनामा देण्याचा काही विचार करत नाही.","मी राजीनामा देण्याचा काही विचार करत नाही, असे शुमकर यांनी एका निवेदनात म्हटले आहे."
main-news,MSRpar,2012train,267,4,एका सर्वेक्षणात असे दिसून आले की महापौरांच्या एफबीआयच्या बगिंगने जीओपी प्रतिस्पर्धी सॅम कॅटझविरूद्धच्या त्याच्या निवडणुकीच्या प्रयत्नास चालना दिली.,या आठवड्यात प्रसिद्ध झालेल्या सर्वेक्षणात असे दिसून आले आहे की महापौरांच्या एफबीआय बगिंगने त्याच्या पुन्हा निवडणुकीच्या प्रयत्नांना चालना दिली आहे.
main-news,MSRpar,2012train,269,3.643,"जॉन पीटर स्मिथ हॉस्पिटलमधील जखमी झालेल्या प्रवाशाचा शुक्रवारी सकाळी मृत्यू झाला, असे जोन्स यांनी सांगितले.","जॉन पीटर स्मिथ येथील जखमी झालेल्या प्रवाशाचा सकाळी नंतर मृत्यू झाला; त्याचे नाव जाहीर झाले नाही, असे जोन्स म्हणाले."
