main-forum,deft-forum,2014,146,4.8,अधिक वाचा: गर्भपात समर्थक असलेल्या कोणालाही आपण कधीही भेटले नाही?,गर्भपात समर्थक असलेल्या कोणालाही आपण कधीही भेटले नाही?
main-forum,deft-forum,2014,147,0.2,ज्यांना पैसे आहेत त्यांच्याशी मला कोणतीही अडचण नाही!,"मला या माणसांशी बर्‍याच समस्या आहेत, बर्‍याच जणांना येथे सांगायचे आहे!"
main-forum,deft-forum,2014,148,2,"निक्सन, फोर्ड आणि कार्टरने ऑईलफिल्ड्स बंद केले?",तेलाची शेतात बंद केलेली नाही.
main-forum,deft-forum,2014,149,1,मला 'काळजी' करणारा अध्यक्ष नको आहे.,मला एक अध्यक्ष नको आहे जो चरमॅसॅटिक आहे.
main-forum,deft-forum,2014,150,0,हे ब्रेनडेड असणे आवश्यक नाही.,माझ्याकडे प्रस्तावित मॉडेल नाही.
main-forum,deft-forum,2014,151,3.2,क्षेपणास्त्र पुरावा नाही.,कोणतेही क्षेपणास्त्र साक्षीदार नाहीत.
main-forum,deft-forum,2014,152,2.2,माझ्या शिक्षकांनी मला सांगितले आहे की हे तुमच्यासाठी वाईट आहे.,अधिका्यांनी मला तुमच्यासाठी हे वाईट सांगितले आहे.
main-forum,deft-forum,2014,153,4.2,"माझ्या गॉश, मी गर्भधारणेच्या टिकरसह एक आहे.",माझ्याकडे गर्भधारणा टिकर आहे.
main-forum,deft-forum,2014,154,1.4,मग तो सर्वशक्तिमान नाही.,मग तो अतुलनीय आहे.
main-forum,deft-forum,2014,155,3,"कुत्राच्या चेह for ्यासाठी टिन फॉइल हॅट, आपण कोणत्या आकारात परिधान करता?","सर्गसाठी टिन फॉइल हॅट, आपण कोणत्या आकाराचे परिधान करता?"
main-forum,deft-forum,2014,156,4.2,या वर्षाप्रमाणेच ज्याला गांजा-संबंधित गुन्ह्यात गोळ्या घालून ठार मारण्यात आले होते.,किंवा गांजाच्या विक्रेत्यांनी स्वयंचलित शस्त्रे देऊन वर्षाच्या मुलाने गोळी झाडली.
main-forum,deft-forum,2014,157,2.6,"आपण हिट करण्यासाठी झेप घेतल्यास, आपल्याला पेनल्टी मिळेल.",जर आपल्या काठीने एखाद्या मुलाला तोंडावर मारले तर आपल्याला दंड मिळत आहे.
main-forum,deft-forum,2014,158,2.4,सर्व विद्युत उर्जा बॅटरीमधून येते.,सर्व विद्युत उर्जा शेवटी अल्टरनेटरमधून येते.
main-forum,deft-forum,2014,159,2.4,आपल्याला माहित आहे की किती प्रवासी साक्ष देतात किंवा त्यांनी काय सांगितले?,किती प्रवासी म्हणाले की त्यांनी हिमशैल पाहिली?
main-forum,deft-forum,2014,160,1.6,% पुरुष आणि % स्त्रियांसह एखाद्या जागेची कल्पना करा.,% पांढरा आणि % काळ्या जागेची कल्पना करा.
main-forum,deft-forum,2014,161,1.75,परिस्थिती एक गृहित धरते की सीओ वाढीचा दर.%/वायआर द्वारे वेग वाढतो.,हे असे गृहीत धरते की मिथेन वाढीचा दर.%/वर्षाने वेग वाढवितो.
main-forum,deft-forum,2014,162,4.6,अलीकडील घट झाल्यामुळे त्यांनी प्रत्यक्षात थंड ट्रेंड दर्शविला आहे.,अलीकडील घसरणीमुळे शीतकरण ट्रेंड मिळवा.
main-forum,deft-forum,2014,163,3,आम्ही सर्व चमत्कारांनी भरलेल्या सर्व जहाज आहोत.,मांजरींमधून लँडन मेमरी आम्ही सर्व चमत्कारांनी भरलेल्या सर्व जहाज आहोत.
main-forum,deft-forum,2014,164,4.5,पुनरावृत्ती करण्यासाठी: ते पूर्वीसारखे सार्वभौम नाहीत.,ते पूर्वीसारखे सार्वभौम नाहीत.
main-forum,deft-forum,2014,165,4.25,"स्पर्श न करता आणि पूर्णपणे अविश्वासू, तथापि, तसे होणार नाही.",स्पर्श आणि अविश्वासू बाहेर?
main-forum,deft-forum,2014,166,3.6,हे मुख्यतः फक्त डच आहे.,"खरं तर, ते फक्त डच आहे."
main-forum,deft-forum,2014,167,4.8,"आम्ही पुन्हा देवदूत आणि सामान्य पिन बद्दल बोलत आहोत, बरोबर?","@लस्टिग आंद्रेई, आम्ही पुन्हा देवदूत आणि सामान्य पिनबद्दल बोलत आहोत, बरोबर?"
main-forum,deft-forum,2014,168,2.6,ट्रेव्हॉनच्या चारित्र्याविषयी दावे आणि मी ते कधी केले?,तिरकस ब्लॉग आणि मी ते कधी केले?
main-forum,deft-forum,2014,169,2.6,% गर्भपात सेवांसाठी पीपी किती पैसे घेते?,गर्भपात सेवांवर किती खर्च केला जातो?
main-forum,deft-forum,2014,170,2.4,तो व्यवहार का झाला.,व्यवहार झाला का?
main-forum,deft-forum,2014,171,2.4,अंडी सेल पोस्ट-फर्टिलायझेशन यापुढे नाही.,यापुढे शुक्राणूंचा सेल नाही.
main-forum,deft-forum,2014,172,4,लेसी - परत आपले स्वागत आहे!,"असो, परत आपले स्वागत आहे."
main-forum,deft-forum,2014,173,4.4,"अधिक तथ्य तपासणे: मला माहित नाही की कोणीही $, पैजांवर गडबड का करीत आहे.","मला माहित नाही की कोणीही $, पैजांवर गडबड का करीत आहे."
main-forum,deft-forum,2014,174,2.4,"आपण कोणतेही दावे केले नसल्यास, असे म्हणा.",मी कोणतेही दावे केले नाहीत.
main-forum,deft-forum,2014,175,2.4,कोणतीही थॅचराइट कधीही स्वत: ला उदारमतवादी म्हणू शकत नाही.,जेव्हा थॅचेरिट्स स्वत: ला उदारमतवादी म्हणतात तेव्हा ते मला अपमान करते.
main-forum,deft-forum,2014,176,2.466666667,कोणाकडे पैसे आहेत ही समस्या नाही.,समस्या अशी आहे की कोणाकडे पैसे नाहीत.
main-forum,deft-forum,2014,177,2.8,पण त्या पाण्यात हिमखंड होता असा आपला खरोखर विश्वास आहे काय?,टायटॅनिकजवळ कोठेही हिमशैल आहे यावर माझा विश्वास नाही.
main-forum,deft-forum,2014,178,3,ऑरिओल्स गेमसाठी अ‍ॅस्ट्रोस किंवा ऑरिओल्स खराब गेमडे माझ्यासाठी गोठलेले नाही.,ऑरिओल्स गेमसाठी गेमडे माझ्यासाठी गोठलेले आहे.
main-forum,deft-forum,2014,179,2.4,"तसे असल्यास, बर्‍याच पोलिसांनी प्रेसीप्शन ड्रग्स घ्याव्यात.","तसे असल्यास, बरेच शोधक, लेखकांनी औषधे लिहून दिली पाहिजेत .."
main-forum,deft-forum,2014,180,4,शुल्क काय होते ते आम्हाला सांगा.,होय त्याचे शुल्क काय आहे.
main-forum,deft-forum,2014,181,1.8,ते आंशिक मनोरुग्ण आहेत.,टेड बंडी हा आंशिक मनोरुग्ण होता?
main-forum,deft-forum,2014,182,4.2,जे इतिहासाकडे दुर्लक्ष करतात ते पुन्हा पुन्हा सांगतात.,इतिहासाकडे दुर्लक्ष करणा two ्या दोन जणांना पुन्हा पुन्हा सांगण्यात आले.
main-forum,deft-forum,2014,183,2.4,ही युद्ध तैनात नाही.,ही अधिकृत तैनात नाही.
main-forum,deft-forum,2014,184,3.6,न्यूट्रॅक्स किस्साचे बहुवचन हा डेटा नाही सज्जनांना चॅपेरोनची आवश्यकता आहे?,पौष्टिक किस्सा अनेकवचनी डेटा नाही
main-forum,deft-forum,2014,185,4,ठीक आहे नुकतेच आत आले.,ठीक नाही ठीक आहे.
main-forum,deft-forum,2014,186,3,एच आणि मी दोघांनीही पुस्तके वाचली आणि विचार केला की चित्रपट इतक्या लवकर हलला आहे.,"मी पुस्तके वाचली नाहीत, परंतु आज मी हा चित्रपट पाहिला."
main-forum,deft-forum,2014,187,2.4,ते मोलोच सीन नाही.,हा मोलोच देखावा आहे.
main-forum,deft-forum,2014,188,4.4,"@लस्टिग आंद्रेई, तर लिंडन जॉन्सन आणि जॉन केनेडी सुसंगत होते?","@एडगर्बलथे, तर लिंडन जॉन्सन आणि जॉन केनेडी सुसंगत होते?"
main-forum,deft-forum,2014,189,0.6,आपल्याला आपले मन तयार करण्याची आवश्यकता आहे.,आपल्याला आपल्या तर्कशास्त्र कौशल्यांवर पॉलिश करणे आवश्यक आहे.
main-forum,deft-forum,2014,190,1.4,जो नंतर घरी चालतो आणि झोपायला जातो.,एक ज्याच्याकडे तीन चालतात आणि आपल्या पत्नीला मारहाण करतात.
main-forum,deft-forum,2014,191,3.8,- अ‍ॅडमिन ड्रिपिझा आणि मी विसरलो की आपण किती लहान बेड ओले आहात.,आणि मी विसरलो की आपण किती लहान बेड ओले आहात.
main-forum,deft-forum,2014,192,4.2,"""अल्बर्ट आइन्स्टाईन कॉलेजमध्ये गेला नाही"" हा युक्तिवाद होता.","ओएमजी, ""आइन्स्टाईन महाविद्यालयात गेले नाही."""
main-forum,deft-forum,2014,193,2.4,"भांडवली नफा, शीर्ष दर: टक्के.","आयकर, उच्च दर: टक्के."
main-forum,deft-forum,2014,194,1,बायंगिंग अबाधित आहे.,मद्यपान करणे अस्वीकार्य आहे.
main-forum,deft-forum,2014,195,3.4,तो वर्षानुवर्षे मजेदार नव्हता.,लॅरी बड मेलमन शोमध्ये असल्याने तो मजेदार नव्हता.
main-forum,deft-forum,2014,196,2.4,जर विश्वाचे अस्तित्वाचे स्पष्टीकरण असेल तर ते स्पष्टीकरण देव आहे.,"म्हणूनच, विश्वाचे अस्तित्वाचे स्पष्टीकरण आहे."
main-forum,deft-forum,2014,197,5,त्यांच्यासाठी लढाई करण्याच्या बदल्यात आम्हाला काय मिळेल?,------ ----------- त्यांच्यासाठी लढाई करण्याच्या बदल्यात आम्हाला काय मिळेल?
main-forum,deft-forum,2014,198,1.2,हे विनोद विवाह थांबवणार नाही.,आणि मी लग्नासाठी लढा देत नाही.
main-forum,deft-forum,2014,199,2.2,जर ते यहूदी असतील तर मी त्यांना यहूदी म्हणत असे.,जर ते कॅथोलिक होते तर मी त्यांना कॅथोलिक म्हणतो.
main-forum,deft-forum,2014,200,4,ती एक महान महिला होती.,ती एक छान बाई होती.
main-forum,deft-forum,2014,201,0.8,तो श्रीमंत नाही कारण तो यशस्वी आहे.,ते यशस्वी झाल्यामुळे लोकांचा तिरस्कार का करतात?
main-forum,deft-forum,2014,202,1.75,आपल्याइतके चिडचिडे नाही.,आपण हेन्रीसारखे चिडचिडे आहात.
main-forum,deft-forum,2014,203,2.5,ही एक सामान्य ज्ञान/कपात करणारी तर्क आहे.,आपली सामान्य ज्ञान/कपात करणारी तर्क करणारी गोष्ट.
main-forum,deft-forum,2014,204,0.8,आपण ते आधीच केले आहे - आमच्याकडे आत्ता कार्यालयात एक मुस्लिम आहे.,-क्रिप्टोल्यूथरन क्र. आमच्याकडे आत्ता एक ख्रिश्चन आहे.
main-forum,deft-forum,2014,205,3.4,मी म्हणालो की तिला कधीही कोणत्याही कामगार दलाचा भाग बनण्याची गरज नाही.,अ‍ॅन रोमनीला कधीही बाहेर पडावे लागले नाही आणि कामगार दलाचा भाग व्हावा लागला नाही.
main-forum,deft-forum,2014,206,3,मला माहित आहे त्याप्रमाणे ड्रीमटेक कधीही स्खलन झाले नाही.,माझ्या माहितीनुसार हे कधीही स्खलन झाले नाही.
main-forum,deft-forum,2014,207,1.2,आम्ही / रँडपासून मऊ झाल्याचे मी म्हणालो नाही.,मी म्हणालो की तू मऊ झाला आहेस.
main-forum,deft-forum,2014,208,3.8,आपल्या सर्वांचा असा विश्वास आहे की आपल्या अपेक्षेनुसार आपण मिळवत आहोत.,"बर्‍याच वेळा, % वेळा, आम्हाला जे अपेक्षित आहे ते मिळत आहे."
main-forum,deft-forum,2014,209,4.4,"निंदनीय बेन, त्या माणसासाठी निमित्त शोधण्याचा प्रयत्न करणे थांबवा.","बेन, त्या माणसासाठी निमित्त शोधण्याचा प्रयत्न करणे थांबवा."
main-forum,deft-forum,2014,210,3.6,जोपर्यंत तो भिन्न देशांमध्ये भिन्न नाही?,"तर, लहान फॉर्म, होय, हे कदाचित वेगवेगळ्या देशांमध्ये भिन्न आहे."
main-forum,deft-forum,2014,211,2.2,नवीन अभ्यास आपल्या दाव्यास समर्थन देत नाही.,भौतिक पुरावा आपल्या दाव्याचे समर्थन करत नाही.
main-forum,deft-forum,2014,212,4.6,तो प्रत्येक स्तरावर म्हणाला.,पण तो प्रत्येक स्तर म्हणाला.
main-forum,deft-forum,2014,213,2.2,"नैतिकता अस्तित्त्वात नाही, म्हणून तांत्रिकदृष्ट्या काहीही नैतिकदृष्ट्या चुकीचे असू शकत नाही.",मी पुन्हा विचारतो की देव अस्तित्त्वात नाही तर काही नैतिकदृष्ट्या चुकीचे असू शकते?
main-forum,deft-forum,2014,214,4,मला वाटले की ते बहुतेक फक्त डच होते.,हे मुख्यतः फक्त डच आहे.
main-forum,deft-forum,2014,215,3.2,जॉनी मॅथिसच्या टोयलँड आम्ही सर्व चमत्कारांनी भरलेल्या सर्व जहाज आहोत.,वाघाचा डोळा आम्ही सर्व चमत्कारांनी भरलेल्या सर्व जहाज आहोत.
main-forum,deft-forum,2014,216,3.8,चला हे प्ले कोर्टात जाऊया.,कोर्टात खेळण्यापासून काहीही थांबत नाही.
main-forum,deft-forum,2014,217,1.8,टोळीमध्ये असणे हा एक गुन्हा नाही.,टोळीमध्ये गुन्हा करणे हा एक गुन्हा आहे.
main-forum,deft-forum,2014,218,4.2,मी इराणला एक करार ऑफर करतो.,चक मी इराणला एक करार ऑफर करतो.
main-forum,deft-forum,2014,219,1.2,"होय, ते दोघेही भिन्न आहेत.",मते भिन्न आहेत.
main-forum,deft-forum,2014,220,1.1,हे नैतिकता लादत नाही.,हे कायदा लादत आहे.
main-forum,deft-forum,2014,221,3.8,अ‍ॅनीने तिच्या लैंगिकतेचा कधी वापर केला आहे का?,एक शब्द: झोम्बीने अ‍ॅनीने तिच्या लैंगिकतेचा वापर कधीही केला आहे?
main-forum,deft-forum,2014,222,2.4,शुद्ध कम्युनिझम: आपल्याकडे दोन गायी आहेत.,उदारमतवादी/अराजक-भांडवलवाद: आपल्याकडे दोन गायी आहेत.
main-forum,deft-forum,2014,223,3.4,आपण वैज्ञानिकांना एका शिखरावर ठेवले पाहिजे.,आपल्यासारख्या लोकांनी वैज्ञानिकांना एका शिखरावर का ठेवले?
main-forum,deft-forum,2014,224,3.6,ते काय लपवण्याचा प्रयत्न करीत आहेत?,मी मग विचारले: ते काय लपवण्याचा प्रयत्न करीत आहेत?
main-forum,deft-forum,2014,225,3,हे आपल्याला त्यांच्या मृत्यूसाठी अंशतः जबाबदार बनवेल.,मला वाटते की हे आपल्याला एक प्रकारचे ory क्सेसरीसाठी बनवेल.
main-forum,deft-forum,2014,226,0,आपण इतरांना आरोग्य सेवा देण्यास आवडेल का?,आपण आपले सीटबेल्ट घालू इच्छिता?
main-forum,deft-forum,2014,227,4.4,ते पूर्वीसारखे सार्वभौम नाहीत.,पुनरावृत्ती करण्यासाठी: ते पूर्वीसारखे सार्वभौम नाहीत.
main-forum,deft-forum,2014,228,2,ओबामा मला दोन वाईट गोष्टींपेक्षा कमी दिसत नाहीत.,मी त्याला अजिबात वाईट म्हणून पाहत नाही.
main-forum,deft-forum,2014,229,3.2,किंवा जिम क्रोस यांनी हे सर्व काही चमत्कारांनी भरलेल्या सर्व जहाज आहोत.,आम्ही सर्व चमत्कारांनी भरलेल्या सर्व जहाज आहोत.
main-forum,deft-forum,2014,230,3.4,मुद्दा असा आहे की एका निशस्त्र मुलाची हत्या केली गेली.,मुद्दा असा आहे की एक निशस्त्र मुलाची हत्या केली गेली होती जो काळा होता.
main-forum,deft-forum,2014,231,0.9,"झिमरमनने उत्तर दिले, ""तू इथे काय करीत आहेस?""","मार्टिन म्हणाला, ""तू माझ्यामागे का येत आहेस?"""
main-forum,deft-forum,2014,232,1.6,मला एक समस्या आहे असे अप्राप्य आहे.,असा धर्म जो असे करत नाही की मला समस्या नाही.
main-forum,deft-forum,2014,233,3.2,जर मी रागावला असेल तर तो त्यापैकी एका स्कॅनमध्ये दिसून येईल ..,"मी हायपर सक्रिय असल्यास, त्यापैकी एका स्कॅनमध्ये ते दर्शविले जाईल .."
main-forum,deft-forum,2014,234,1.4,"आपण एक्सवायझेड इंक मध्ये billion अब्ज डॉलर्स खरेदी करू इच्छित असल्यास कॉमन स्टॉक, कोण काळजी घेतो?","आपण घर किंवा एसयूव्ही खरेदी करू इच्छित असल्यास, पुन्हा कोणाची काळजी आहे?"
main-forum,deft-forum,2014,235,1.533333333,अब्ज. मेक्सिकोच्या सध्याच्या समृद्धी पातळीवर जगातील प्रत्येकजण.,"वायव्य आफ्रिकेच्या सध्याच्या ""समृद्धी"" पातळीवर जगातील प्रत्येकजण."
main-forum,deft-forum,2014,236,3.1,जर आपण उत्तर दिले तर आणि आपण कदाचित सरळ आहात.,जर आपण उत्तर दिले नाही परंतु होय म्हणून आपण कदाचित सरळ आहात.
