main-captions,MSRvid,2012test,1,5,एक विमान बंद आहे.,एक एअर प्लेन बंद आहे.
main-captions,MSRvid,2012test,4,3.8,एक माणूस एक मोठा बासरी खेळत आहे.,एक माणूस बासरी वाजवत आहे.
main-captions,MSRvid,2012test,5,3.8,एक माणूस पिझ्झावर कचरा चीज पसरवित आहे.,एक माणूस शिजवलेल्या पिझ्झावर चिरलेला चीज पसरवित आहे.
main-captions,MSRvid,2012test,6,2.6,तीन पुरुष बुद्धिबळ खेळत आहेत.,दोन माणसे बुद्धिबळ खेळत आहेत.
main-captions,MSRvid,2012test,9,4.25,एक माणूस सेलो खेळत आहे.,बसलेला माणूस सेलो खेळत आहे.
main-captions,MSRvid,2012test,11,4.25,काही पुरुष भांडत आहेत.,दोन माणसे भांडत आहेत.
main-captions,MSRvid,2012test,12,0.5,एक माणूस धूम्रपान करीत आहे.,एक माणूस स्केटिंग आहे.
main-captions,MSRvid,2012test,13,1.6,माणूस पियानो खेळत आहे.,माणूस गिटार वाजवत आहे.
main-captions,MSRvid,2012test,14,2.2,एक माणूस गिटार आणि गातात खेळत आहे.,एक स्त्री ध्वनिक गिटार आणि गाणे वाजवत आहे.
main-captions,MSRvid,2012test,16,5,एखादी व्यक्ती मांजरीला कमाल मर्यादेपर्यंत फेकत आहे.,एखादी व्यक्ती मांजरीला छतावर फेकते.
main-captions,MSRvid,2012test,17,4.2,त्या माणसाने दुसर्‍या माणसाला काठीने मारले.,त्या माणसाने एका काठीने दुसर्‍या माणसाला स्पॅन्क केले.
main-captions,MSRvid,2012test,18,4.6,एक स्त्री उचलते आणि बाळ कांगारू ठेवते.,एक स्त्री उचलते आणि तिच्या हातात बाळ कांगारू ठेवते.
main-captions,MSRvid,2012test,19,3.867,एक माणूस बासरी वाजवत आहे.,एक माणूस बांबूची बासरी वाजवत आहे.
main-captions,MSRvid,2012test,20,4.667,एखादी व्यक्ती कागदाचा तुकडा दुमडत आहे.,कोणीतरी कागदाचा तुकडा दुमडत आहे.
main-captions,MSRvid,2012test,21,1.667,एक माणूस रस्त्यावर धावत आहे.,रस्त्यावर एक पांडा कुत्रा चालू आहे.
main-captions,MSRvid,2012test,22,3.75,एक कुत्रा त्याच्या पाठीवर खारवून वाळवलेले डुकराचे मांस करण्याचा प्रयत्न करीत आहे.,एक कुत्रा त्याच्या पाठीवर खारवून वाळवलेले डुकराचे मांस खाण्याचा प्रयत्न करीत आहे.
main-captions,MSRvid,2012test,25,5,ध्रुवीय अस्वल बर्फावर सरकत आहे.,एक ध्रुवीय अस्वल बर्फ ओलांडून सरकतो.
main-captions,MSRvid,2012test,26,0.5,एक स्त्री लिहित आहे.,एक स्त्री पोहत आहे.
main-captions,MSRvid,2012test,28,3.8,एक मांजर बाळाच्या चेह against ्याविरूद्ध घासत आहे.,एक मांजर बाळाच्या विरूद्ध घासत आहे.
main-captions,MSRvid,2012test,29,5,माणूस घोड्यावर स्वार होत आहे.,एक माणूस घोड्यावरुन चालत आहे.
main-captions,MSRvid,2012test,30,3.2,एक माणूस भांड्यात तेल ओततो.,एक माणूस भांड्यात वाइन ओततो.
main-captions,MSRvid,2012test,31,2.8,एक माणूस गिटार वाजवत आहे.,एक मुलगी गिटार वाजवत आहे.
main-captions,MSRvid,2012test,32,4.6,एक पांडा एक स्लाइड खाली सरकत आहे.,एक पांडा एक स्लाइड खाली सरकतो.
main-captions,MSRvid,2012test,34,3,एक स्त्री काहीतरी खात आहे.,एक स्त्री मांस खात आहे.
main-captions,MSRvid,2012test,35,5,एक स्त्री बटाटा सोलते.,एक स्त्री बटाटा सोलून आहे.
main-captions,MSRvid,2012test,38,4.8,मुलगा त्याच्या दुचाकीवरून खाली पडला.,एक मुलगा त्याच्या दुचाकीवरून खाली पडला.
main-captions,MSRvid,2012test,40,5,बाई बासरी वाजवत आहे.,एक स्त्री बासरी वाजवत आहे.
main-captions,MSRvid,2012test,42,4.2,गरुड पासून एक ससा चालू आहे.,गरुड पासून एक हरे चालू आहे.
main-captions,MSRvid,2012test,44,4.2,बाई ब्रेडड डुकराचे मांस चॉप तळत आहे.,एक स्त्री ब्रेडड डुकराचे मांस चॉप शिजत आहे.
main-captions,MSRvid,2012test,46,4,एक मुलगी पतंग उडत आहे.,धावणारी मुलगी पतंग उडवित आहे.
main-captions,MSRvid,2012test,47,4,एक माणूस मेकॅनिकल बैल चालवित आहे.,एक माणूस यांत्रिक बैल चालविला.
main-captions,MSRvid,2012test,48,4.909,माणूस गिटार वाजवत आहे.,एक माणूस गिटार वाजवत आहे.
main-captions,MSRvid,2012test,50,3,एक स्त्री इतर महिलांसह नाचत आहे आणि गात आहे.,एक महिला पावसात नाचत आहे आणि गात आहे.
main-captions,MSRvid,2012test,52,2.4,एक माणूस बन कापत आहे.,एक माणूस कांदा कापत आहे.
main-captions,MSRvid,2012test,53,4.2,एक माणूस पॅनमध्ये तेल ओतत आहे.,एक माणूस स्किलेटमध्ये तेल ओतत आहे.
main-captions,MSRvid,2012test,54,3.4,एक सिंह लोकांशी खेळत आहे.,एक सिंह दोन माणसांसह खेळत आहे.
main-captions,MSRvid,2012test,55,5,एक कुत्रा स्केटबोर्ड चालवितो.,एक कुत्रा स्केटबोर्ड चालवित आहे.
main-captions,MSRvid,2012test,56,3.75,कोणीतरी पुतळा कोरत आहे.,एक माणूस पुतळा कोरत आहे.
main-captions,MSRvid,2012test,57,2.75,एक स्त्री कांदा कापत आहे.,एक माणूस कांदा कापत आहे.
main-captions,MSRvid,2012test,58,5,एक स्त्री कोळंबी सोलते.,एक स्त्री कोळंबी सोललेली आहे.
main-captions,MSRvid,2012test,59,4,एक स्त्री मासे तळत आहे.,एक स्त्री मासे शिजवत आहे.
main-captions,MSRvid,2012test,61,3.6,एक स्त्री इलेक्ट्रिक गिटार वाजवत आहे.,एक स्त्री गिटार वाजवत आहे.
main-captions,MSRvid,2012test,62,1.6,एक बेबी टायगर बॉलसह खेळत आहे.,एक बाळ बाहुलीसह खेळत आहे.
main-captions,MSRvid,2012test,64,1.75,एखादी व्यक्ती टोमॅटो कापत आहे.,एखादी व्यक्ती काही मांस कापत आहे.
main-captions,MSRvid,2012test,65,5,एखादी व्यक्ती कांदा कापते.,एखादी व्यक्ती कांदा कापत आहे.
main-captions,MSRvid,2012test,68,1,एक माणूस पियानो खेळत आहे.,एक स्त्री व्हायोलिन खेळत आहे.
main-captions,MSRvid,2012test,69,1,एक स्त्री बासरी वाजवत आहे.,एक माणूस गिटार वाजवत आहे.
main-captions,MSRvid,2012test,70,2.375,एक माणूस बटाटा कापत आहे.,एक माणूस गाजर कापत आहे.
main-captions,MSRvid,2012test,71,3.8,एक मूल गिटार वाजवत आहे.,एक मुलगा गिटार वाजवत आहे.
main-captions,MSRvid,2012test,72,3.2,एक मुलगा गिटार वाजवत आहे.,एक माणूस गिटार वाजवत आहे.
main-captions,MSRvid,2012test,73,3.2,एक माणूस गिटार वाजवत आहे.,एक मुलगा गिटार वाजवत आहे.
main-captions,MSRvid,2012test,75,4.4,एक लहान मुलगा कीबोर्ड खेळत आहे.,एक मुलगा की बोर्ड खेळत आहे.
main-captions,MSRvid,2012test,77,3.75,एक माणूस गिटार वाजवत आहे.,एक माणूस इलेक्ट्रिक गिटार वाजवत आहे.
main-captions,MSRvid,2012test,78,4.75,एक कुत्रा बाळाला चाटतो.,एक कुत्रा बाळाला चाटत आहे.
main-captions,MSRvid,2012test,80,3.2,एक स्त्री कांदा कापत आहे.,एक माणूस कापत आहे आणि कांदा आहे.
main-captions,MSRvid,2012test,81,1.556,एक माणूस गिटार वाजवत आहे.,एक माणूस ड्रम खेळत आहे.
main-captions,MSRvid,2012test,83,3.938,एक स्त्री मिरपूड कापत आहे.,एक स्त्री लाल मिरची कापत आहे.
main-captions,MSRvid,2012test,84,5,एक माणूस ड्रम खेळत आहे.,एक माणूस ड्रम वाजवतो.
main-captions,MSRvid,2012test,85,5,एक स्त्री घोड्यावर स्वार करते.,एक स्त्री घोड्यावर स्वार आहे.
main-captions,MSRvid,2012test,86,4,एक माणूस झाडाजवळ केळी खात आहे.,एक माणूस केळी खात आहे.
main-captions,MSRvid,2012test,87,1.6,एक मांजर एक की बोर्ड खेळत आहे.,एक माणूस दोन कीबोर्ड खेळत आहे.
main-captions,MSRvid,2012test,89,4.75,एक माणूस कु ax ्हाडीने झाडाला खाली चोपतो.,एका माणसाने कु ax ्हाडीने झाड कापले.
main-captions,MSRvid,2012test,90,3.5,एक मुल खेळणी फोनसह खेळतो.,एक लहान मुलगा टॉय फोनसह खेळतो.
main-captions,MSRvid,2012test,93,1.4,एक माणूस मोटरसायकल चालवित आहे.,एक माणूस घोड्यावर स्वार होत आहे.
main-captions,MSRvid,2012test,94,1.4,एक माणूस मोटरसायकल चालवित आहे.,एक माणूस घोड्यावर स्वार होत आहे.
main-captions,MSRvid,2012test,99,4,मंडळांमध्ये एक गिलहरी फिरत आहे.,मंडळांमध्ये एक गिलहरी फिरते.
main-captions,MSRvid,2012test,101,5,एक माणूस आणि एक स्त्री चुंबन घेत आहे.,एक माणूस आणि स्त्री चुंबन.
main-captions,MSRvid,2012test,102,3.833,एक माणूस गाडीत येत आहे.,एक माणूस गॅरेजमध्ये कारमध्ये जात आहे.
main-captions,MSRvid,2012test,104,0.6,एक माणूस नाचत आहे.,एक माणूस बोलत आहे.
main-captions,MSRvid,2012test,105,2.917,एक माणूस गिटार वाजवत आहे आणि गात आहे.,एक माणूस गिटार वाजवत आहे.
main-captions,MSRvid,2012test,106,4.2,एखादी व्यक्ती मशरूम कापत आहे.,एखादी व्यक्ती चाकूने मशरूम कापत आहे.
main-captions,MSRvid,2012test,108,2,एक वाघाचा क्यूब आवाज काढत आहे.,वाघ फिरत आहे.
main-captions,MSRvid,2012test,109,2.6,एखादी व्यक्ती कांदे कापत आहे.,एखादी व्यक्ती कांदा सोलत आहे.
main-captions,MSRvid,2012test,110,1.6,एक माणूस पियानो खेळत आहे.,एक माणूस रणशिंग खेळत आहे.
main-captions,MSRvid,2012test,111,2,एक स्त्री बटाटा सोलून आहे.,एक स्त्री सफरचंद सोलून आहे.
main-captions,MSRvid,2012test,112,4.2,एक पंकडा बांबू खात आहे.,पांडा अस्वल काही बांबू खात आहे.
main-captions,MSRvid,2012test,113,2,एखादी व्यक्ती कांदा सोलत आहे.,एखादी व्यक्ती एग्प्लान्ट सोलत आहे.
main-captions,MSRvid,2012test,114,4.8,एक माकड दुसर्‍या माकडला ढकलतो.,माकडने दुसर्‍या माकडला ढकलले.
main-captions,MSRvid,2012test,115,4.4,मंडळांमध्ये एक गिलहरी फिरते.,एक गिलहरी मंडळांमध्ये फिरत आहे.
main-captions,MSRvid,2012test,116,5,एक माणूस आपला जोडा बांधत आहे.,एक माणूस आपला जोडा बांधतो.
main-captions,MSRvid,2012test,117,3,एक मुलगा गात आहे आणि पियानो वाजवत आहे.,एक मुलगा पियानो खेळत आहे.
main-captions,MSRvid,2012test,118,4.25,एक कुत्रा पाण्याचे खरबूज खात आहे.,एक कुत्रा टरबूजचा तुकडा खात आहे.
main-captions,MSRvid,2012test,119,4.25,एक स्त्री ब्रोकोली तोडत आहे.,एक स्त्री चाकूने ब्रोकोली तोडत आहे.
main-captions,MSRvid,2012test,120,3.8,एक माणूस बटाटा सोलून आहे.,एका माणसाने बटाटा सोलला.
main-captions,MSRvid,2012test,121,2.4,एक स्त्री गिटार वाजवत आहे.,एक माणूस गिटार वाजवतो.
main-captions,MSRvid,2012test,123,1.6,एक स्त्री टोमॅटो कापत आहे.,एक माणूस कांदा कापत आहे.
main-captions,MSRvid,2012test,125,2,एक माणूस पाण्याखाली पोहतो.,एक स्त्री पाण्याखाली पोहत आहे.
main-captions,MSRvid,2012test,126,1.6,एक माणूस आणि स्त्री बोलत आहेत.,एक माणूस आणि स्त्री खात आहे.
main-captions,MSRvid,2012test,129,4,एक लहान कुत्रा योग बॉलचा पाठलाग करीत आहे.,एक कुत्रा बॉलचा पाठलाग करीत आहे.
main-captions,MSRvid,2012test,130,2.2,पुरुष क्रिकेट खेळत आहेत.,पुरुष बास्केटबॉल खेळत आहेत.
main-captions,MSRvid,2012test,131,4.4,एक माणूस मोटरसायकलवरुन चालतो.,एक माणूस मोटारसायकलवर चालत आहे.
main-captions,MSRvid,2012test,132,3.6,एक माणूस गिटार वाजवत आहे.,एक माणूस गायन करीत आहे आणि गिटार वाजवित आहे.
main-captions,MSRvid,2012test,133,3.6,तो माणूस टेलिफोनवर बोलला.,माणूस फोनवर बोलत आहे.
main-captions,MSRvid,2012test,135,0.5,एक माणूस मासेमारी करीत आहे.,एक माणूस व्यायाम करीत आहे.
main-captions,MSRvid,2012test,136,0.8,एक माणूस लेव्हिंग करत आहे.,एक माणूस बोलत आहे.
main-captions,MSRvid,2012test,138,0.6,दोन मुले ड्रायव्हिंग करत आहेत.,दोन खाडी नाचत आहेत.
main-captions,MSRvid,2012test,141,2.6,एक माणूस घोड्यावरुन चालत आहे.,एक मुलगी घोड्यावर स्वार होत आहे.
main-captions,MSRvid,2012test,142,2,एक माणूस सायकल चालवित आहे.,एक माकड बाईक चालवित आहे.
main-captions,MSRvid,2012test,143,2.2,एक माणूस बटाटे कापत आहे.,एक स्त्री बटाटा सोलून आहे.
main-captions,MSRvid,2012test,144,2.4,एक स्त्री बटाटा सोलून आहे.,एक माणूस बटाटा कापत आहे.
main-captions,MSRvid,2012test,145,3.6,एक माणूस गिटार वाजवत आहे.,कुणाची गिटार वाजवत आहे.
main-captions,MSRvid,2012test,148,2.2,एक स्त्री लीक कापत आहे.,एक स्त्री आले कापत आहे.
main-captions,MSRvid,2012test,149,4.8,त्या माणसाने पेपर प्लेट कापली.,एक माणूस पेपर प्लेट कापत आहे.
main-captions,MSRvid,2012test,151,1.643,माणूस गिटार वाजवत आहे.,एक माणूस बासरी वाजवत आहे.
main-captions,MSRvid,2012test,152,1.75,एक माणूस पियानो खेळत आहे.,माणूस व्हायोलिन खेळत आहे.
main-captions,MSRvid,2012test,154,2.25,एक स्त्री काही मांस कापत आहे.,एक स्त्री काही मांस ब्रेड करत आहे.
main-captions,MSRvid,2012test,155,4,एक माणूस त्याच्या कीबोर्डवर खेळत आहे.,एक माणूस कीबोर्ड पियानो खेळत आहे.
main-captions,MSRvid,2012test,157,4.8,लेडीने हिरव्या कांदे तोडला.,त्या बाईने हिरव्या कांदा कापला.
main-captions,MSRvid,2012test,158,3.2,कोणीतरी पाण्यात नूडल्स सिट्रिंग करीत आहे.,एक स्त्री पाण्यात नूडल्स उकळत आहे.
main-captions,MSRvid,2012test,160,4,लिओनेल रिची कमाल मर्यादेवर नाचत आहे.,कमाल मर्यादेवर उभे असताना लिओनेल रिची नाचते.
main-captions,MSRvid,2012test,161,4.4,एक माणूस पियानो खेळत आहे.,एक व्यक्ती पियानो खेळत आहे.
main-captions,MSRvid,2012test,163,4.6,एक स्त्री बासरी वाजवत आहे.,एक स्त्री बासरीवर खेळते.
main-captions,MSRvid,2012test,164,3.8,एक मुलगा कॅलेंडरची तपासणी करीत आहे.,एक मुलगा कॅलेंडरकडे पहात आहे.
main-captions,MSRvid,2012test,165,4.8,एक स्त्री कांदा कापत आहे.,एक स्त्री कांदे तोडत आहे.
main-captions,MSRvid,2012test,166,4.857,एक माणूस गिटार वाजवत आहे.,एक माणूस गिटार वाजवतो.
main-captions,MSRvid,2012test,167,5,एक स्त्री शिवणकाम मशीन वापरत आहे.,एक स्त्री मशीनवर शिवणकाम करीत आहे.
main-captions,MSRvid,2012test,168,2.533,एक स्त्री पॅनकेक्स फ्लिप करीत आहे.,एक कार्टून शेफ पॅनकेक्स फ्लिप करीत आहे.
main-captions,MSRvid,2012test,172,1,एक माणूस रस्त्यावर धावत आहे.,एक गाडी रस्त्यावरुन गाडी चालवित आहे.
main-captions,MSRvid,2012test,175,1,एक माणूस घोड्यावरुन चालत आहे.,एक माणूस फोनवर बोलत आहे.
main-captions,MSRvid,2012test,176,2,एक माणूस दुचाकी चालवित आहे.,एक माणूस घोड्यावरुन चालत आहे.
main-captions,MSRvid,2012test,178,0.143,एक स्त्री नाचत आहे.,एक माणूस खात आहे.
main-captions,MSRvid,2012test,179,2,एक माणूस पियानो खेळत आहे.,एक माणूस बासरी वाजवत आहे.
main-captions,MSRvid,2012test,180,1.6,एक माणूस बासरी वाजवत आहे.,एक माणूस पियानो खेळत आहे.
main-captions,MSRvid,2012test,182,1.6,एक माणूस फिरत आहे.,एक माणूस नाचत आहे.
main-captions,MSRvid,2012test,184,3.4,एक माकड अंगातून अंगात फिरत आहे.,एक माकड झाडापासून झाडावर फिरत आहे.
main-captions,MSRvid,2012test,185,4,लोक ट्रेनमधून उतरले.,लोक स्टेशनवर ट्रेनमधून खाली उतरले.
main-captions,MSRvid,2012test,187,4.8,एक कुत्रा ट्रॅम्पोलिनवर उडी मारत आहे.,एक कुत्रा ट्रॅम्पोलिनवर बाउन्स करतो.
main-captions,MSRvid,2012test,188,2.5,एक मुलगा एक इन्स्ट्रुमेंट वाजवित आहे.,एक माणूस रणशिंग खेळत आहे.
main-captions,MSRvid,2012test,190,1.75,एक स्त्री गिटार वाजवते.,एक माणूस गिटार गातो आणि वाजवतो.
main-captions,MSRvid,2012test,191,1,एक स्त्री कॅन निवडत आहे.,एक स्त्री टोमॅटो कापत आहे.
main-captions,MSRvid,2012test,192,5,एक माणूस दोरीवर चढत आहे.,एक माणूस दोरीवर चढतो.
main-captions,MSRvid,2012test,193,1.4,एक माणूस कार उचलत आहे.,एक माणूस भिंतीवर चढत आहे.
main-captions,MSRvid,2012test,195,4,एक माणूस आणि स्त्री जीपमध्ये रस्त्यावरुन खाली जात आहे.,एक माणूस आणि महिला खुल्या हवाई वाहनातून रस्त्यावरुन खाली जात आहेत.
main-captions,MSRvid,2012test,196,3.8,शर्टलेस माणूस खुर्चीवर बसला.,एक शर्टलेस माणूस खुर्चीवर बसला आहे.
