main-news,headlines,2013,380,3.2,7th व्या फ्रेंच ओपन टायटलसाठी नदाल जोकोविचमध्ये अव्वल आहे,टेनिस: मॉन्टे कार्लो शीर्षकासाठी नदालने जोकोविचचा पराभव केला
main-news,headlines,2013,381,3,चाईल्ड केअरची किंमत जवळजवळ 6% वाढली आहे,"चाईल्ड केअर 'वर्षाकाठी ��15,000'"
main-news,headlines,2013,382,3.4,ओबामा यांनी युरोप कर्जाच्या संकटावर निर्णायक कारवाईची विनंती केली,ओबामा यांनी युरोपला संकटावर त्वरेने कार्य करण्याचे आवाहन केले
main-news,headlines,2013,383,1,बीफ बर्गर मिक्स साल्मोनेला चिंतेवर परत बोलावले,चॉक पावडर साल्मोनेला चिंतेवर परत बोलावले
main-news,headlines,2013,384,4.2,"ओबामा, रोमनी पहिल्या वादाची तयारी करतात","ओबामा, रोमनी वादविवादाची तयारी करतात"
main-news,headlines,2013,385,0.8,प्रथम लक्षणीय गॅस किनारपट्टीवर केनिया सापडला,केनियामध्ये नवीनतम लँड संघर्षात रायडर 38 मारतात
main-news,headlines,2013,386,2.2,रेड क्रॉस कामगार पाकिस्तानमध्ये ठार झाला,पाकिस्तानमध्ये यूके मदत कामगारांना अपहरण केले
main-news,headlines,2013,388,3.4,गाझाकडून दक्षिणेकडील इस्राएलमध्ये 8 रॉकेट्स उडाले; काहीही दुखापत झाली नाही,दक्षिणेकडील इस्रायलमधील गाझा लँडमधील दहा रॉकेट्स; काहीही दुखापत झाली नाही
main-news,headlines,2013,391,1.6,एस. अफगाणिस्तानात शूटिंगच्या घटनेत अमेरिकेच्या सैनिकाने ठार मारले,अफगाणिस्तानात पाच नाटो सैनिक ठार झाले
main-news,headlines,2013,392,0.8,इजिप्शियन राष्ट्रपती पदाच्या निवडणुकीत मतदान बंद करा,प्रेस रिलीझः येमेनी राष्ट्रपती पदाच्या निवडणुकीत
main-news,headlines,2013,393,1.2,सॅव्हिले दावे पोलिसांनी 'लिंक केले नाही',बीबीसीला सावली प्रकरण खेचण्यासाठी प्रश्नांचा सामना करावा लागतो
main-news,headlines,2013,394,3.4,युरोझोन बेरोजगारी 11 टक्के रेकॉर्डवर राहते,युरोझोन बेरोजगारी रेकॉर्ड उच्च आहे
main-news,headlines,2013,395,4.2,जेम्स मर्डोच बीएसकेबी सोडतात,जेम्स मर्डोच बीएसकीबी येथे भूमिका सोडतात
main-news,headlines,2013,396,4.8,आयकॉनिक सायन्स फिक्शन लेखक रे ब्रॅडबरीचा मृत्यू 91 वाजता झाला,विज्ञान कल्पित आख्यायिका रे ब्रॅडबरी 91 वाजता मृत
main-news,headlines,2013,397,0.6,23-24 मे रोजी इजिप्त राष्ट्रपतीपदाची निवडणूक,अमेरिकेच्या राष्ट्रपती पदाची निवडणूक २०१२
main-news,headlines,2013,398,3.4,अफगाणच्या आत्मघाती स्फोटात चार फ्रेंच सैनिक ठार झाले,अफगाण पूर्वेमध्ये चार परदेशी सैनिक ठार झाले
main-news,headlines,2013,399,4,यूएन निरीक्षकांना सीरियन हत्याकांडाचा मागोवा सापडतो,यूएन टीम सीरियन हत्याकांडाची तपासणी करते
main-news,headlines,2013,400,3.6,एपी पोलः आमच्यात बहुसंख्य काळ्या लोकांविरूद्ध पूर्वग्रह आहे,एपी पोलः बहुसंख्य हार्बर काळ्या लोकांविरूद्ध पूर्वग्रह
main-news,headlines,2013,401,4.2,एपी स्रोत: रेडस्किन्स क्रमांक 2 निवडीसाठी व्यापार करण्यासाठी,रेडस्किन्स क्रमांक 2 निवडीसाठी व्यापार
main-news,headlines,2013,402,4,चीन म्हणतो की २०१२ मध्ये संरक्षण बजेट ११.२ टक्क्यांनी वाढेल,चीनचा संरक्षण खर्च ११.२% वाढला
main-news,headlines,2013,403,0,इराकच्या स्फोटांची स्ट्रिंग कमीतकमी 32 ठार करते,मजबूत इटली भूकंप कमीतकमी सहा ठार
main-news,headlines,2013,404,3.8,इक्वाडोरचे अध्यक्ष कोरिया म्हणतात की असांज आश्रय वर कोणताही निर्णय घेतला नाही,असांजेच्या आश्रयस्थानावर अद्याप इक्वाडोर निर्णय घेणार नाही
main-news,headlines,2013,406,3.8,यूएस यूएस $ 10 मिली ऑफर करते. पाकिस्तान अतिरेकी साठी,पाकिस्तानी अतिरेकी प्रमुखांसाठी अमेरिका 10 दशलक्ष डॉलर्स ऑफर करते
main-news,headlines,2013,407,3.8,अफगाणिस्तान आयईडी हल्ल्यात 6 नाटो सैन्याने ठार केले,अफगाणिस्तानात 6 नाटो सैन्याने ठार केले
main-news,headlines,2013,408,0.8,ओसामा बिन लादेन बायका तुरूंगात टाकल्या जातील,ओसामा बिन लादेन चित्रपट भारतात चित्रीकरणासाठी
main-news,headlines,2013,409,4,इजिप्शियन लोक राष्ट्रपती पदाच्या निवडणुकीत मतदान करतात,ऐतिहासिक निवडणुकीत इजिप्शियन मतदानात जातात
main-news,headlines,2013,410,3.8,फ्लाइटमध्ये व्यत्यय आणणार्‍या जेटब्लू पायलटने दोषी नसून वेडे घोषित केले,फ्लाइटमध्ये व्यत्यय आणणारे जेटब्ल्यू पायलट दोषी नाही
main-news,headlines,2013,411,2.2,त्सुनामी चेतावणी: एसए घाबरण्याची गरज नाही,आचे भूकंपानंतर त्सुनामी चेतावणी
main-news,headlines,2013,412,4.8,यूएस बग्राम कारागृह अफगाण अधिका to ्यांकडे हात द्या,यू.एस. बाग्राम कारागृह अफगाण नियंत्रणात हस्तांतरित करते
main-news,headlines,2013,413,2,जेरेमी हंट स्वत: ला सल्लागारापासून दूर ठेवते ज्यांनी 'मार्क ओव्हरस्टेप' केले,जेरेमी हंट न्यूज कॉर्प ईमेलवर स्पॅड सोडत आहे
main-news,headlines,2013,414,0.4,ओबामा यांनी यू.एस.-लॅटिन अमेरिका व्यापार संबंधांचे कौतुक केले,ओबामा सिक्रेट सर्व्हिस एजंट्सने घरी पाठविले
main-news,headlines,2013,415,2,ब्लिट्झबोकके फिजीने हद्दपार केले,ब्लिट्झबोककेने एनझेडने मारहाण केली
main-news,headlines,2013,416,0.4,ओबामा आणि रोमनी स्विंग-स्टेटवर लक्ष केंद्रित करतात,टीम अण्णा अद्याप राज्य मतदान स्पर्धेत निर्णय घेणार नाही
main-news,headlines,2013,418,0.2,ग्रेनेड अटॅक 'एकाला ठार मारतो आणि कमीतकमी 11 जखमी होतो,महिलेवर लैंगिक हल्ला तपासला
main-news,headlines,2013,420,1.4,सीरियामध्ये असंख्य मृतदेह सापडतात,जहाजावर आणखी आठ मृतदेह सापडले
main-news,headlines,2013,421,0.8,अमेरिकन ब्लॅक टीनच्या हत्येचा आरोप नेमबाज,काळ्या अध्यक्षांच्या अधीन असलेल्या वंश संबंधांवर विचार
main-news,headlines,2013,422,1.8,मुंबईत इंग्लंडसाठी जॉनी बेअरस्टो आणि इयन मॉर्गन शाईन,भारत टूर सामन्यात बेअरस्टोने टनला हिट केले
main-news,headlines,2013,424,4.4,पवन फार्म डेव्हलपर्सने टर्बाइन्स खरोखरच त्यापेक्षा लहान दिसण्यासाठी कॅमेरा युक्त्या कशा वापरतात ',टर्बाइन्स लहान दिसण्यासाठी 'युक्त्या' वापरणारे पवन फार्म विकसक
main-news,headlines,2013,425,2.4,अमेरिकेच्या ड्रोनने पाकिस्तानमध्ये सहा अतिरेक्यांना ठार मारले: अधिकारी,पाकिस्तानमध्ये अमेरिकन क्षेपणास्त्र 15 मारतात: अधिकारी
main-news,headlines,2013,428,2.6,नायजेरिया: नायजेरियन सैन्याने 40 विद्यार्थ्यांच्या हत्याकांडात ठार झाल्यानंतर झुंडी दिली,महाविद्यालयाच्या हत्याकांडानंतर नायजेरिया पोलिस अटक करतात
main-news,headlines,2013,429,2.2,नसा शांत झाला - आत्तासाठी: स्पॅनिश बँक बेलआउटपेक्षा बाजारपेठा आरामात उडी मारतात,स्पेनने बँक बेलआउट सुरक्षित केल्यानंतर ग्रीसकडे लक्ष केंद्रित केले
main-news,headlines,2013,430,1.4,सिरियाच्या अलेप्पोमध्ये जबरदस्त लढाई नोंदविली गेली,दमास्कसमध्ये भारी लढाई नोंदविली
main-news,headlines,2013,431,1.8,फ्रान्स म्हणतो ग्रीसने युरोझोनसाठी विश्वासार्हता दर्शविली पाहिजे,फ्रान्सच्या हॉलंडेने ग्रीसला पाठिंबा दर्शविला पण विश्वासार्ह सुधारणांचा आग्रह धरला
main-news,headlines,2013,432,1.2,अ‍ॅव्हेंजर्सने बॉक्स ऑफिस रेकॉर्ड सेट केले,हंगर गेम्स आम्हाला बॉक्स ऑफिसचा विक्रम मोडतो
main-news,headlines,2013,433,1,अफगाणिस्तानात 4 फ्रेंच सैनिक ठार झाल्याची नोंद झाली,अफगाणिस्तानात ब्रिटीश सैनिक ठार झाला
main-news,headlines,2013,434,3.4,स्पॅनिश बेलआउट कोंडी अधिक तीव्र होते,स्पॅनिश कोंडी अधिक तीव्र होते
main-news,headlines,2013,435,0.6,अफगाणिस्तानात नाटोचा सैनिक मरण पावला,अफगाणिस्तानात दोन ऑस्ट सैनिक जखमी झाले
main-news,headlines,2013,436,2.4,चिनी समभाग बुधवारी कमी उघडतात,चीनचा साठा शुक्रवारी कमी खुला आहे
main-news,headlines,2013,437,1,पॅलेस्टाईनचे नेतृत्व इस्त्रायली एफएम कॉलला अब्बास यांना निषेध करते,पॅलेस्टाईन नेतृत्व फताह-हमास दोहा कराराला पाठिंबा देते
main-news,headlines,2013,438,4.8,मिट रोमनीने मेरीलँड जीओपी प्राइमरी जिंकली,रोमनीने मेरीलँड रिपब्लिकन प्राइमरी जिंकली
main-news,headlines,2013,439,3.6,चोरी झाल्यानंतर 42 वर्षांनंतर मॅनला ईबेवर कार सापडली,टेक्सासच्या माणसाला त्याची कार चोरी झाल्यानंतर 42 वर्षांनंतर सापडली
main-news,headlines,2013,440,3.4,सिल्वेस्टर स्टॅलोनचा मुलगा हॉलीवूडमध्ये मृत सापडला,"सिल्वेस्टर स्टॅलोनचा मुलगा, सेज स्टॅलोन, हॉलमध्ये मृत सापडला"
main-news,headlines,2013,441,2.8,नाटो: 4 मदत कामगारांनी अफगाण बंडखोरांकडून सुटका केली,5 मदत कामगार अफगाणिस्तानात कार्यरत मुक्त
main-news,headlines,2013,442,1.8,रशिया तुरूंगात पुच्ची दंगल निषेध दोन वर्षांसाठी,मांजरीच्या दंगली खटल्यात राज्य करण्यासाठी रशियन कोर्ट
main-news,headlines,2013,444,4.4,इस्त्राईलने जर्मन लेखक गवतला कविता ओलांडण्यापासून रोखले,इस्त्राईलने कविता ओलांडून जर्मन लेखक गवत बंद केले
main-news,headlines,2013,445,1.8,1 ऑगस्ट 2012 रोजी नोटचे वाचणे आवश्यक आहे,बुधवार 4 जुलै 2012 रोजी नोटची वाचन करणे आवश्यक आहे
main-news,headlines,2013,446,2.4,अफगाण नागरिकांच्या शूटिंगवर नाटो यूएस सैन्याने ताब्यात घेतले,अफगाण नागरिकांवर गोळीबार करून अमेरिकेचे म्हणणे आहे
main-news,headlines,2013,447,1.6,हॉलंडेने फ्रेंच राष्ट्रपतीपदाची निवडणूक जिंकली,पूर्व तिमोर राष्ट्रपतीपदाच्या निवडणुकीत मते
main-news,headlines,2013,449,1.8,सैन्य: सीरिया रासायनिक समभागांनी इस्रायलला धोका दर्शविला आहे,रशिया सीरियाला सांगते की रासायनिक शस्त्राचा धोका अस्वीकार्य आहे
main-news,headlines,2013,450,3.6,फिश अपग्रेड्स फोर्ड इन इन्व्हेस्टमेंट ग्रेड,फिच फोर्ड क्रेडिट गुंतवणूक ग्रेडमध्ये पुनर्संचयित करते
main-news,headlines,2013,451,2,"सीरिया पीस प्लॅन अटी - अनियंत्रित, ""विरोधी पक्ष म्हणतात",अंतिम मुदत संपताच सीरिया शांतता कमी झाली
main-news,headlines,2013,453,2.4,ग्रीक अधिक कटबॅकचा निषेध म्हणून संघर्ष,ग्रीक मत जवळ येताच संघर्ष फुटला
main-news,headlines,2013,454,2.4,"9 मृत, 11 दुखापत, 4 मॉन्ट ब्लँक हिमस्खलनात हरवले","6 मृत, मॉन्ट ब्लँक हिमस्खलनात अनेक गहाळ"
main-news,headlines,2013,455,4.6,हेरगिरीसाठी फेसबुकवर 'आकर्षक महिला' म्हणून तालिबान,सैन्याच्या रहस्ये मिळविण्यासाठी तालिबानचे सैनिक फेसबुकवर सुंदर महिला म्हणून पोस्ट करतात
main-news,headlines,2013,456,1.2,चीनचे कार्यकर्ते चेन अमेरिकेत उतरतात,चिनी कार्यकर्ते अन्याय लढण्यासाठी कॉल करतात
main-news,headlines,2013,457,3.2,सिटी रूम: एम्पायर स्टेट बिल्डिंग शूटिंग,एम्पायर स्टेट बिल्डिंगच्या बाहेर शूटिंगमध्ये 2 मृत
main-news,headlines,2013,458,4.4,मोहम्मद मोर्सीने एग्प्टियन अध्यक्ष म्हणून शपथ घेतली,मुर्सी यांनी इजिप्शियन अध्यक्ष म्हणून शपथ घेतली
main-news,headlines,2013,460,1,अफगाणिस्तानात नाटो तळावर झालेल्या हल्ल्यात 15 जण ठार झाले,मदत कामगार अफगाणिस्तानात छापा टाकत आहेत
main-news,headlines,2013,461,1,"येमेन आत्मघाती स्फोट, ड्रोन अटॅक कमीतकमी 30",इराकच्या हल्ल्यांच्या हल्ले कमीतकमी सहा ठार
main-news,headlines,2013,462,3,ऑलिम्पिक बिड अयशस्वी झाल्यानंतर टॉरेस पुढे जात आहे,"टॉरेसने चौथे स्थान मिळविले, सहाव्या ऑलिम्पिकवर गमावले"
main-news,headlines,2013,464,2.8,पाकिस्तानने बिन लादेन कंपाऊंडचे विध्वंस सुरू केले,पाकिस्तानने ओसामा बिन लादेन हिडआऊट सोडला
main-news,headlines,2013,465,3.6,खार्तूम शस्त्रास्त्रांच्या आगीसाठी सुदानने इस्राएलला दोष दिला,सुदान इस्त्राईलवर शस्त्रास्त्र कारखान्यावर हवाई हल्ल्याचा आरोप आहे
main-news,headlines,2013,466,3.8,पगाराच्या कर मापनावर हाऊस-सेन्ट डील गाठली,वाटाघाटी करणारे कॉंग्रेस पेरोल टॅक्स कट बिलावरील करारावर पोहोचतात
main-news,headlines,2013,468,1.4,"उष्णकटिबंधीय वादळ इसहाक ड्रेन्चेस हैती, स्वाइप क्युबा",उष्णकटिबंधीय वादळ इसहाकने धरणाची धमकी दिली
main-news,headlines,2013,471,2.2,परदेशी पॅलेस्टाईन समर्थक कार्यकर्ते वेस्ट बँकमध्ये प्रवेश करण्याचा प्रयत्न करतात,१०० पॅलेस्टाईन लोक len लनबी येथे इस्त्राईलमध्ये प्रवेश करण्याचा प्रयत्न करतात
main-news,headlines,2013,473,3,"युरोपियन युनियन, अमेरिकेच्या उत्तेजनाच्या आशेवर जागतिक समभाग वाढतात",फेड उत्तेजनाच्या आशेवर साठा वाढतो
main-news,headlines,2013,474,4,"Gore 86 वाजता गोरे विडाल डेड: दिग्गज लेखक, नाटककार आणि राजकारणी मरण पावले","गोर विडाल, साजरा केलेला लेखक, नाटककार, 86 वाजता मरण पावला"
main-news,headlines,2013,476,2.4,ग्रीक कर्जाच्या डीलच्या अंतिम मुदतीपूर्वी जागतिक समभाग पडतात,ग्रीक कर्जाच्या डीलच्या अंतिम मुदतीपेक्षा आशिया समभाग खाली पडतात
main-news,headlines,2013,477,4.2,दक्षिण आफ्रिका पोलिसांनी 30 खाण कामगारांना ठार मारले,दक्षिण आफ्रिका पोलिसांचे म्हणणे आहे की त्यांनी 30+ खाण कामगारांना ठार मारले
main-news,headlines,2013,478,2.4,"इसहाक ड्रेन्चेस हैती, क्युबा, फ्लोरिडाकडे डोके",इसहाक बेघर भूकंपाच्या लोकसंख्येसह हैतीला जवळ आहे
main-news,headlines,2013,479,1.2,ब्रिटन सीरियाच्या विरोधात पोहोचला,सीरियन लोकांची काळजी कोण आहे?
main-news,headlines,2013,481,4,ओबामा तरुण स्थलांतरितांसाठी हद्दपारीचे नियम शिथिल करतात,यू.एस. तरुण लोकांसाठी हद्दपारीचे नियम शिथिल करते: नेपोलिटानो
main-news,headlines,2013,482,3.8,मायक्रोसॉफ्टच्या पृष्ठभागावर एक मोठी पैज: विश्लेषक,"मायक्रोसॉफ्टच्या पृष्ठभागावरील टॅब्लेट आश्वासक, परंतु प्रश्न बाकी आहेत"
main-news,headlines,2013,483,3.6,व्हाईट 'बल्गरच्या मैत्रिणीला 8 वर्षे मिळते,"मॉबस्टर ""व्हाईट"" बल्गरच्या मैत्रिणीला 8 वर्षे मिळते"
